{
  "$schema": "https://json-schema.org/draft/2020-12/schema",
  "$id": "https://github.com/deradon/wow-forever-talent-calc/data/schema/race-matrix.schema.json",
  "title": "WoW Forever race/class matrix",
  "description": "Derived view of data/races/*.json: which class every race can play. Generated by pipeline/stages/12_races.py build; never hand-edited. Normative prose: docs/DATA-SCHEMA-RACES.md section 5.",
  "type": "object",
  "additionalProperties": false,
  "required": ["schemaVersion", "dataSource", "generatedAt", "classes", "races"],
  "properties": {
    "$schema": {
      "type": "string"
    },
    "schemaVersion": {
      "type": "integer",
      "const": 1
    },
    "dataSource": {
      "enum": ["video", "datamined", "mixed", "manual"]
    },
    "generatedAt": {
      "type": "string",
      "pattern": "^\\d{4}-\\d{2}-\\d{2}T\\d{2}:\\d{2}:\\d{2}(\\.\\d+)?(Z|[+-]\\d{2}:\\d{2})$"
    },
    "classes": {
      "type": "array",
      "description": "Class ids in the order the class bar shows them, left to right.",
      "items": {
        "$ref": "#/$defs/classId"
      }
    },
    "races": {
      "type": "array",
      "items": {
        "type": "object",
        "additionalProperties": false,
        "required": ["race", "raceName", "faction", "classes", "observed"],
        "properties": {
          "race": {
            "type": "string",
            "pattern": "^[a-z0-9]+(-[a-z0-9]+)*$"
          },
          "raceName": {
            "type": "string"
          },
          "faction": {
            "enum": ["alliance", "horde", "neutral"]
          },
          "classes": {
            "type": "array",
            "uniqueItems": true,
            "items": {
              "$ref": "#/$defs/classId"
            }
          },
          "byVariant": {
            "type": "object",
            "description": "Per-variant class lists where they differ (Skyborne).",
            "additionalProperties": {
              "type": "array",
              "items": {
                "$ref": "#/$defs/classId"
              }
            }
          },
          "observed": {
            "type": "boolean",
            "description": "false when the class bar was never on screen for this race."
          },
          "reportedElsewhere": {
            "type": "array",
            "items": {
              "$ref": "#/$defs/classId"
            }
          },
          "agreement": {
            "type": "string"
          },
          "disagreement": {
            "type": "string"
          }
        }
      }
    },
    "notes": {
      "type": "array",
      "items": {
        "type": "string"
      }
    }
  },
  "$defs": {
    "classId": {
      "enum": ["druid", "hunter", "mage", "paladin", "priest", "rogue", "shaman", "warlock", "warrior"]
    }
  }
}
